<?xml version="1.0"?>
<!--
    Formatting specifications and column titles.

    Copyright (C) 2004, 2005, 2006, 2007 Gregory W. Chicares.

    This program is free software; you can redistribute it and/or modify
    it under the terms of the GNU General Public License version 2 as
    published by the Free Software Foundation.

    This program is distributed in the hope that it will be useful,
    but WITHOUT ANY WARRANTY; without even the implied warranty of
    MERCHANTABILITY or FITNESS FOR A PARTICULAR PURPOSE.  See the
    GNU General Public License for more details.

    You should have received a copy of the GNU General Public License
    along with this program; if not, write to the Free Software Foundation,
    Inc., 51 Franklin St, Fifth Floor, Boston, MA 02110-1301, USA

    http://savannah.nongnu.org/projects/lmi
    email: <chicares@cox.net>
    snail: Chicares, 186 Belle Woods Drive, Glastonbury CT 06033, USA

    $Id: ledger_formats.xml,v 1.5 2007-06-27 13:40:56 etarassov Exp $

    TODO ?? This file contains only 'column' elements, but they don't
    all correspond to columns: e.g., 'LapseYear' is a scalar and
    couldn't be shown as a column. Either a more-generic entity name
    should be used, or columns and scalars should be distinguished.

    TODO ?? Titles ought to be read from an external file that
    permits flexible customization. Compliance might require that
    'AcctVal_Current' be called "Cash Value" for one policy form,
    and "Account Value" for another, in order to match the terms
    used in the contract exactly. Therefore, these titles probably
    belong in the product database, which permits variation by
    product - though it does not accommodate strings as this is
    written in 2006-07. DATABASE !! So consider adding them there
    when the database is revamped.
-->
<columns xmlns="http://savannah.nongnu.org/projects/lmi" xmlns:xsi="http://www.w3.org/2001/XMLSchema-instance" xsi:schemaLocation="http://savannah.nongnu.org/projects/lmi ledger.xsd">
    <column name="GuarMaxMandE">
        <format>f4</format>
    </column>
    <column name="InitAnnGenAcctInt">
        <format>f4</format>
    </column>
    <column name="InitAnnLoanCredRate">
        <format>f4</format>
    </column>
    <column name="InitAnnLoanDueRate">
        <format>f4</format>
    </column>
    <column name="InitAnnSepAcctGrossInt">
        <format>f4</format>
    </column>
    <column name="InitAnnSepAcctCurrGross0Rate">
        <format>f4</format>
    </column>
    <column name="InitAnnSepAcctCurrGrossHalfRate">
        <format>f4</format>
    </column>
    <column name="InitAnnSepAcctNetInt">
        <format>f4</format>
    </column>
    <column name="InitAnnSepAcctCurrNet0Rate">
        <format>f4</format>
    </column>
    <column name="InitAnnSepAcctCurrNetHalfRate">
        <format>f4</format>
    </column>
    <column name="InitAnnSepAcctGuarGross0Rate">
        <format>f4</format>
    </column>
    <column name="InitAnnSepAcctGuarGrossHalfRate">
        <format>f4</format>
    </column>
    <column name="InitAnnSepAcctGuarNet0Rate">
        <format>f4</format>
    </column>
    <column name="InitAnnSepAcctGuarNetHalfRate">
        <format>f4</format>
    </column>
    <column name="PostHoneymoonSpread">
        <format>f4</format>
    </column>
    <column name="Preferred">
        <format>f4</format>
    </column>
    <column name="PremTaxRate">
        <format>f4</format>
    </column>
    <column name="StatePremTaxRate">
        <format>f4</format>
    </column>

    <!--
        F3: scaled by 100, zero decimals, with '%' at end:
        Format as percentage with no decimal places (##0%)
    -->
    <column name="GenAcctAllocation">
        <format>f3</format>
    </column>
    <column name="SalesLoadRefund">
        <format>f3</format>
    </column>
    <column name="SalesLoadRefundRate0">
        <format>f3</format>
    </column>
    <column name="SalesLoadRefundRate1">
        <format>f3</format>
    </column>

    <!--
        F2: two decimals, commas
        Format as a number with thousand separators and two decimal places (#,###,###.00)
    -->
    <column name="CountryCOIMultiplier">
        <format>f2</format>
    </column>
    <column name="GuarPrem">
        <format>f2</format>
    </column>
    <column name="InitGLP">
        <format>f2</format>
    </column>
    <column name="InitGSP">
        <format>f2</format>
    </column>
    <column name="InitPrem">
        <format>f2</format>
    </column>
    <column name="InitSevenPayPrem">
        <format>f2</format>
    </column>
    <column name="InitTgtPrem">
        <format>f2</format>
    </column>

    <!--
        F1: zero decimals, commas
        Format as a number with thousand separators and no decimal places (#,###,###)
    -->
    <column name="Age">
        <format>f1</format>
    </column>
    <column name="AvgFund">
        <format>f1</format>
    </column>
    <column name="AllowDbo3">
        <format>f1</format>
    </column>
    <column name="ChildRiderAmount">
        <format>f1</format>
    </column>
    <column name="CustomFund">
        <format>f1</format>
    </column>
    <column name="SupplementalReport">
        <format>f1</format>
    </column>
    <column name="DBOptInitInteger">
        <format>f1</format>
    </column>
    <column name="Dumpin">
        <format>f1</format>
    </column>
    <column name="EndtAge">
        <format>f1</format>
    </column>
    <column name="External1035Amount">
        <format>f1</format>
    </column>
    <column name="GenderBlended">
        <format>f1</format>
    </column>
    <column name="GenderDistinct">
        <format>f1</format>
    </column>
    <column name="Has1035ExchCharge">
        <format>f1</format>
    </column>
    <column name="HasADD">
        <format>f1</format>
    </column>
    <column name="HasChildRider">
        <format>f1</format>
    </column>
    <column name="HasHoneymoon">
        <format>f1</format>
    </column>
    <column name="HasSpouseRider">
        <format>f1</format>
    </column>
    <column name="HasTerm">
        <format>f1</format>
    </column>
    <column name="HasWP">
        <format>f1</format>
    </column>
    <column name="InforceMonth">
        <format>f1</format>
    </column>
    <column name="InforceYear">
        <format>f1</format>
    </column>
    <column name="InitBaseSpecAmt">
        <format>f1</format>
    </column>
    <column name="InitTermSpecAmt">
        <format>f1</format>
    </column>
    <column name="InitTotalSA">
        <format>f1</format>
    </column>
    <column name="InforceIsMec">
        <format>f1</format>
    </column>
    <column name="Internal1035Amount">
        <format>f1</format>
    </column>
    <column name="IsInforce">
        <format>f1</format>
    </column>
    <column name="IsMec">
        <format>f1</format>
    </column>
    <column name="IsSubjectToIllustrationReg">
        <format>f1</format>
    </column>
    <column name="LapseMonth">
        <format>f1</format>
    </column>
    <column name="LapseYear">
        <format>f1</format>
    </column>
    <column name="MaxDuration">
        <format>f1</format>
    </column>
    <column name="MecMonth">
        <format>f1</format>
    </column>
    <column name="MecYear">
        <format>f1</format>
    </column>
    <column name="NoLapse">
        <format>f1</format>
    </column>
    <column name="NoLapseAlwaysActive">
        <format>f1</format>
    </column>
    <column name="NoLapseMinAge">
        <format>f1</format>
    </column>
    <column name="NoLapseMinDur">
        <format>f1</format>
    </column>
    <column name="NominallyPar">
        <format>f1</format>
    </column>
    <column name="PremiumTaxLoadIsTiered">
        <format>f1</format>
    </column>
    <column name="RetAge">
        <format>f1</format>
    </column>
    <column name="SmokerBlended">
        <format>f1</format>
    </column>
    <column name="SmokerDistinct">
        <format>f1</format>
    </column>
    <column name="SpouseIssueAge">
        <format>f1</format>
    </column>
    <column name="StatePremTaxLoad">
        <format>f1</format>
    </column>
    <column name="UseExperienceRating">
        <format>f1</format>
    </column>
    <column name="UsePartialMort">
        <format>f1</format>
    </column>

    <!--
        F3: scaled by 100, zero decimals, with '%' at end:
        Format as percentage with no decimal places (##0%)
    -->
    <column name="CorridorFactor">
        <title>Corridor Factor</title><!-- _____________ Corridor Factor -->
        <format>f3</format>
    </column>
    <column name="FundAllocations">
        <format>f3</format>
    </column>
    <column name="MaleProportion">
        <format>f3</format>
    </column>
    <column name="NonsmokerProportion">
        <format>f3</format>
    </column>
    <column name="PartMortTableMult">
        <title>Partial Mortality Muliplier</title>
        <format>f3</format>
    </column>

    <!--
        F4: scaled by 100, two decimals, with '%' at end:
        Format as percentage with two decimal places (##0.00%)
    -->
    <column name="AnnGAIntRate">
        <title basis="run_curr_basis">Curr Ann Gen Acct Int Rate</title><!-- Curr Ann Gen Acct Int Rate -->
        <title basis="run_guar_basis">Guar Ann Gen Acct Int Rate</title>
        <format>f4</format>
    </column>
    <column name="AnnHoneymoonValueRate">
        <title basis="run_curr_basis">Curr Ann Honeymoon Value Rate</title>
        <title basis="run_guar_basis">Guar Ann Honeymoon Value Rate</title>
        <format>f4</format>
    </column>
    <column name="AnnPostHoneymoonRate">
        <title basis="run_curr_basis">Curr Post Honeymoon Rate</title>
        <title basis="run_guar_basis">Guar Post Honeymoon Rate</title>
        <format>f4</format>
    </column>
    <column name="AnnSAIntRate">
        <title basis="run_curr_basis">Curr Ann Sep Acct Int Rate</title>